{
  "schema_version": "1.0.0",
  "catalog_version": "2026-09-14.1",
  "reviewed_on": "2026-09-14",
  "title": "Knowledge Garden",
  "scope": "A selected, source-reviewed map of project work. It is not an exhaustive Library inventory, a full conversation archive or a model of everything a person knows.",
  "rules": [
    "Hierarchy is navigation; typed relations have their own scope.",
    "Related material is not evidence merely because it is linked.",
    "Source contracts, reported results, local candidates and new implementation have distinct statuses.",
    "Working sets are proposals; selection carries no authority or evidence promotion.",
    "Private source documents and original personal conversation records remain outside this public catalog.",
    "Each project retains its own admission rules and scientific claim boundary."
  ],
  "nodes": [
    {
      "id": "other-projects",
      "name": "Other Projects",
      "kind": "group",
      "parent_id": null,
      "summary": "A growing directory of connected work. Each project keeps its own sources, state and next step.",
      "status": "navigation",
      "evidence_status": "new integration",
      "source_ids": [
        "expression-home",
        "garden-design"
      ],
      "tags": [
        "directory"
      ],
      "next_action": "Choose a trail or open a branch."
    },
    {
      "id": "workspace",
      "name": "Workspace & memory",
      "kind": "group",
      "parent_id": "other-projects",
      "summary": "Sources, routing, companions and small working sets.",
      "status": "navigation",
      "evidence_status": "new integration",
      "source_ids": [
        "garden-design"
      ],
      "tags": [
        "workspace"
      ],
      "next_action": "Explore a project and inspect its next action."
    },
    {
      "id": "methods",
      "name": "Methods & meaning",
      "kind": "group",
      "parent_id": "other-projects",
      "summary": "How claims, language and records retain their meaning.",
      "status": "navigation",
      "evidence_status": "new integration",
      "source_ids": [
        "garden-design"
      ],
      "tags": [
        "methods"
      ],
      "next_action": "Explore a project and inspect its next action."
    },
    {
      "id": "research",
      "name": "Research clearings",
      "kind": "group",
      "parent_id": "other-projects",
      "summary": "Independent investigations with bounded evidence.",
      "status": "navigation",
      "evidence_status": "new integration",
      "source_ids": [
        "garden-design"
      ],
      "tags": [
        "research"
      ],
      "next_action": "Explore a project and inspect its next action."
    },
    {
      "id": "practical",
      "name": "Practical workshop",
      "kind": "group",
      "parent_id": "other-projects",
      "summary": "Tools whose source exists, with execution and acceptance gaps visible.",
      "status": "navigation",
      "evidence_status": "new integration",
      "source_ids": [
        "garden-design"
      ],
      "tags": [
        "practical"
      ],
      "next_action": "Explore a project and inspect its next action."
    },
    {
      "id": "expression",
      "name": "Expression & learning",
      "kind": "group",
      "parent_id": "other-projects",
      "summary": "Expression archives, section carriers and learning workflows.",
      "status": "navigation",
      "evidence_status": "new integration",
      "source_ids": [
        "garden-design"
      ],
      "tags": [
        "expression"
      ],
      "next_action": "Explore a project and inspect its next action."
    },
    {
      "id": "knowledge-garden",
      "name": "Knowledge Garden",
      "kind": "project",
      "parent_id": "workspace",
      "summary": "Browse hierarchies, inspect typed connections and assemble a proposed working set.",
      "status": "implemented",
      "evidence_status": "new implementation",
      "source_ids": [
        "garden-design"
      ],
      "tags": [
        "api",
        "hierarchy",
        "discovery",
        "working set"
      ],
      "next_action": "Choose a bounded task and export only the relevant catalog entries."
    },
    {
      "id": "library",
      "name": "Library",
      "kind": "project",
      "parent_id": "workspace",
      "summary": "Preserved materials and exact source handles; the selected catalog is a small view of the larger collection.",
      "status": "source reviewed",
      "evidence_status": "source reviewed",
      "source_ids": [
        "orbit-current",
        "master-organization"
      ],
      "tags": [
        "sources",
        "preservation",
        "archive"
      ],
      "next_action": "Resolve exact identity and lineage before admitting a source."
    },
    {
      "id": "orbit",
      "name": "Orbit",
      "kind": "project",
      "parent_id": "workspace",
      "summary": "Organize current material, historical predecessors and supporting candidates while keeping projects independent.",
      "status": "source reviewed",
      "evidence_status": "source reviewed",
      "source_ids": [
        "orbit-current",
        "master-organization",
        "independent-projects"
      ],
      "tags": [
        "lineage",
        "routing",
        "preservation"
      ],
      "next_action": "Use the current obligation to choose a small, recoverable source set."
    },
    {
      "id": "orbit-current",
      "name": "Current",
      "kind": "role",
      "parent_id": "orbit",
      "summary": "Small active navigation surface; a pointer may retain an older dependency note.",
      "status": "source role",
      "evidence_status": "source reviewed",
      "source_ids": [
        "orbit-current",
        "master-organization"
      ],
      "tags": [
        "source role",
        "current"
      ],
      "next_action": "Retain source identity and distinguish membership from evidence."
    },
    {
      "id": "orbit-history",
      "name": "History",
      "kind": "role",
      "parent_id": "orbit",
      "summary": "Preserved predecessors with explicit chronology and identity.",
      "status": "source role",
      "evidence_status": "source reviewed",
      "source_ids": [
        "orbit-current",
        "master-organization"
      ],
      "tags": [
        "source role",
        "history"
      ],
      "next_action": "Retain source identity and distinguish membership from evidence."
    },
    {
      "id": "orbit-support",
      "name": "Support",
      "kind": "role",
      "parent_id": "orbit",
      "summary": "Helpers and candidates awaiting a task-specific admission decision.",
      "status": "source role",
      "evidence_status": "source reviewed",
      "source_ids": [
        "orbit-current",
        "master-organization"
      ],
      "tags": [
        "source role",
        "support"
      ],
      "next_action": "Retain source identity and distinguish membership from evidence."
    },
    {
      "id": "orbit-incoming",
      "name": "Incoming",
      "kind": "role",
      "parent_id": "orbit",
      "summary": "New material whose presence does not establish admission.",
      "status": "source role",
      "evidence_status": "source reviewed",
      "source_ids": [
        "orbit-current",
        "master-organization"
      ],
      "tags": [
        "source role",
        "incoming"
      ],
      "next_action": "Retain source identity and distinguish membership from evidence."
    },
    {
      "id": "orbit-transfer",
      "name": "Transfer",
      "kind": "role",
      "parent_id": "orbit",
      "summary": "Custody and transfer records connecting source identities.",
      "status": "source role",
      "evidence_status": "source reviewed",
      "source_ids": [
        "orbit-current",
        "master-organization"
      ],
      "tags": [
        "source role",
        "transfer"
      ],
      "next_action": "Retain source identity and distinguish membership from evidence."
    },
    {
      "id": "master-librarian",
      "name": "Master Librarian · 2.0",
      "kind": "project",
      "parent_id": "workspace",
      "summary": "Route obligations and keep needed material reachable. The organizing role does not decide scientific truth.",
      "status": "source reviewed",
      "evidence_status": "source reviewed",
      "source_ids": [
        "master-organization"
      ],
      "tags": [
        "master",
        "router",
        "working set"
      ],
      "next_action": "State the current obligation, choose sufficient material and preserve the remainder."
    },
    {
      "id": "master-plan",
      "name": "Master Plan · 2.2",
      "kind": "component",
      "parent_id": "master-librarian",
      "summary": "Minimize active material while preserving fidelity, protection, evidence, recoverability and correction.",
      "status": "source contract",
      "evidence_status": "source reviewed",
      "source_ids": [
        "master-organization"
      ],
      "tags": [
        "activation",
        "recovery"
      ],
      "next_action": "Keep the next working set small enough to inspect and complete."
    },
    {
      "id": "master-learning-route",
      "name": "Learning route · 2.6",
      "kind": "component",
      "parent_id": "master-librarian",
      "summary": "Require explicit classification of learner responses; preserve unfinished learning when a project task arrives.",
      "status": "historical checks reported",
      "evidence_status": "reported verification, not replayed",
      "source_ids": [
        "master-learning"
      ],
      "tags": [
        "learning",
        "input",
        "output",
        "routing"
      ],
      "next_action": "Recheck the exact package before runtime reuse; keep optional succession separate from authority."
    },
    {
      "id": "companions",
      "name": "Companion dock",
      "kind": "group",
      "parent_id": "workspace",